{
  "generator": "scripts/compare_pdf_ocr_outputs.py",
  "outputs": {
    "mineru_high_effort_hybrid_forced_ocr": {
      "bytes_utf8": 5245,
      "characters": 5219,
      "engine": "MinerU 3.4.4 hybrid-engine, effort high, mode ocr",
      "line_count": 219,
      "markdown_display_math_blocks": 14,
      "markdown_image_references": 7,
      "nonspace_characters": 4354,
      "source_relpath": "build/document_ocr/mineru/Comment_on_the_Pais_Superforce_Theory/hybrid_ocr/Comment_on_the_Pais_Superforce_Theory.md",
      "source_sha256": "c9434a70f1e71131e58cc8d16f1c6a390e7972f20ecc177008148376fbfefc71",
      "word_tokens": 736
    },
    "native_pdftotext_layout": {
      "bytes_utf8": 3611,
      "characters": 3545,
      "engine": "pdftotext -layout",
      "line_count": 137,
      "nonspace_characters": 1822,
      "word_tokens": 315
    },
    "tesseract_400_dpi_psm_1": {
      "bytes_utf8": 2672,
      "characters": 2622,
      "engine": "tesseract 5.5.2",
      "line_count": 203,
      "manifest_relpath": "build/document_ocr/tesseract/Comment_on_the_Pais_Superforce_Theory/manifest.json",
      "manifest_sha256": "a93cb3a1e45cb77c81c01c412b55ffa3729a2115ce7e6cbb39a1ec0d3bcee4c0",
      "nonspace_characters": 2080,
      "page_count": 13,
      "word_tokens": 414
    }
  },
  "provenance": {
    "run_manifest_relpath": "data/registry/document_ocr_run_manifest.json",
    "run_manifest_sha256": "bff319e4d6d576eb7d2503bb49c99fc765ed3b772973a7bc9ec4ec92312b29ea",
    "visual_review_relpath": "data/registry/pdf_ocr_visual_review.json",
    "visual_review_sha256": "7ad9f0ab09bfa5f94467f82fe732cac0d8767c599ac932fcd35108ea70ae5122"
  },
  "schema_version": 1,
  "selection": {
    "basis": "MinerU passes the equation, reading-order, and diagram criteria on the reviewed sparse page. Tesseract remains useful as an independent prose fallback. Character counts are not treated as accuracy.",
    "fallback": "tesseract_400_dpi_psm_1",
    "primary": "mineru_high_effort_hybrid_forced_ocr"
  },
  "source_pdf": {
    "relpath": "source_materials/pdfs/Comment_on_the_Pais_Superforce_Theory.pdf",
    "sha256": "ca32b85da9dc732509ea4560184c160e2e503f56bea861c7a05542040f9e9b75"
  }
}
